[
  {
    "id": 322,
    "countryCode": "JO",
    "country": "jordan",
    "countryName": "Jordan",
    "documentType": "id_card",
    "documentId": "jordan_id_card",
    "width": 35,
    "height": 45,
    "unit": "mm",
    "dpi": 600,
    "backgroundColor": "#ffffff",
    "widthMm": 35,
    "heightMm": 45,
    "needsReview": true
  },
  {
    "id": 323,
    "countryCode": "JO",
    "country": "jordan",
    "countryName": "Jordan",
    "documentType": "id_card",
    "documentId": "jordan_residence",
    "width": 35,
    "height": 45,
    "unit": "mm",
    "dpi": 600,
    "backgroundColor": "#ffffff",
    "widthMm": 35,
    "heightMm": 45
  },
  {
    "id": 324,
    "countryCode": "JO",
    "country": "jordan",
    "countryName": "Jordan",
    "documentType": "other",
    "documentId": "jordan_work_permit",
    "width": 35,
    "height": 45,
    "unit": "mm",
    "dpi": 600,
    "backgroundColor": "#ffffff",
    "widthMm": 35,
    "heightMm": 45
  },
  {
    "id": 325,
    "countryCode": "JO",
    "country": "jordan",
    "countryName": "Jordan",
    "documentType": "passport",
    "documentId": "jordan_passport",
    "width": 35,
    "height": 45,
    "unit": "mm",
    "dpi": 600,
    "backgroundColor": "#ffffff",
    "widthMm": 35,
    "heightMm": 45,
    "needsReview": true
  },
  {
    "id": 326,
    "countryCode": "JO",
    "country": "jordan",
    "countryName": "Jordan",
    "documentType": "visa",
    "documentId": "jordan_visa",
    "width": 35,
    "height": 45,
    "unit": "mm",
    "dpi": 600,
    "backgroundColor": "#ffffff",
    "widthMm": 35,
    "heightMm": 45
  }
]
