[
  {
    "id": 327,
    "countryCode": "KZ",
    "country": "kazakhstan",
    "countryName": "Kazakhstan",
    "documentType": "id_card",
    "documentId": "kazakhstan_id_card",
    "width": 35,
    "height": 45,
    "unit": "mm",
    "dpi": 300,
    "backgroundColor": "#eeeeee",
    "widthMm": 35,
    "heightMm": 45
  },
  {
    "id": 328,
    "countryCode": "KZ",
    "country": "kazakhstan",
    "countryName": "Kazakhstan",
    "documentType": "id_card",
    "documentId": "kazakhstan_id_card_online",
    "width": 413,
    "height": 531,
    "unit": "px",
    "dpi": 300,
    "backgroundColor": "#eeeeee",
    "pixelWidth": 413,
    "pixelHeight": 531
  },
  {
    "id": 329,
    "countryCode": "KZ",
    "country": "kazakhstan",
    "countryName": "Kazakhstan",
    "documentType": "id_card",
    "documentId": "kazakhstan_seaman_s_book",
    "width": 30,
    "height": 40,
    "unit": "mm",
    "dpi": 600,
    "backgroundColor": "#ffffff",
    "widthMm": 30,
    "heightMm": 40
  },
  {
    "id": 330,
    "countryCode": "KZ",
    "country": "kazakhstan",
    "countryName": "Kazakhstan",
    "documentType": "passport",
    "documentId": "kazakhstan_passport",
    "width": 35,
    "height": 45,
    "unit": "mm",
    "dpi": 300,
    "backgroundColor": "#eeeeee",
    "widthMm": 35,
    "heightMm": 45
  },
  {
    "id": 331,
    "countryCode": "KZ",
    "country": "kazakhstan",
    "countryName": "Kazakhstan",
    "documentType": "passport",
    "documentId": "kazakhstan_passport_online",
    "width": 413,
    "height": 531,
    "unit": "px",
    "dpi": 300,
    "backgroundColor": "#eeeeee",
    "pixelWidth": 413,
    "pixelHeight": 531
  },
  {
    "id": 332,
    "countryCode": "KZ",
    "country": "kazakhstan",
    "countryName": "Kazakhstan",
    "documentType": "visa",
    "documentId": "kazakhstan_visa",
    "width": 35,
    "height": 45,
    "unit": "mm",
    "dpi": 600,
    "backgroundColor": "#eeeeee",
    "widthMm": 35,
    "heightMm": 45
  }
]
