[
  {
    "id": 221,
    "countryCode": "DE",
    "country": "germany",
    "countryName": "Germany",
    "documentType": "driving_licence",
    "documentId": "germany_driving_license",
    "width": 35,
    "height": 45,
    "unit": "mm",
    "dpi": 600,
    "backgroundColor": "#eeeeee",
    "widthMm": 35,
    "heightMm": 45,
    "headMinMm": 32,
    "headMaxMm": 36,
    "expressionStrict": true,
    "expression": "neutral, mouth closed, eyes open"
  },
  {
    "id": 222,
    "countryCode": "DE",
    "country": "germany",
    "countryName": "Germany",
    "documentType": "id_card",
    "documentId": "germany_doctor_s_identity_card",
    "width": 35,
    "height": 45,
    "unit": "mm",
    "dpi": 600,
    "backgroundColor": "#eeeeee",
    "widthMm": 35,
    "heightMm": 45,
    "headMinMm": 32,
    "headMaxMm": 36,
    "expressionStrict": true,
    "expression": "neutral, mouth closed, eyes open"
  },
  {
    "id": 223,
    "countryCode": "DE",
    "country": "germany",
    "countryName": "Germany",
    "documentType": "id_card",
    "documentId": "germany_id_card",
    "width": 35,
    "height": 45,
    "unit": "mm",
    "dpi": 600,
    "backgroundColor": "#eeeeee",
    "widthMm": 35,
    "heightMm": 45,
    "headMinMm": 32,
    "headMaxMm": 36,
    "expressionStrict": true,
    "expression": "neutral, mouth closed, eyes open"
  },
  {
    "id": 224,
    "countryCode": "DE",
    "country": "germany",
    "countryName": "Germany",
    "documentType": "id_card",
    "documentId": "germany_lawyer_id_card",
    "width": 35,
    "height": 45,
    "unit": "mm",
    "dpi": 600,
    "backgroundColor": "#eeeeee",
    "widthMm": 35,
    "heightMm": 45,
    "headMinMm": 32,
    "headMaxMm": 36,
    "expressionStrict": true,
    "expression": "neutral, mouth closed, eyes open"
  },
  {
    "id": 225,
    "countryCode": "DE",
    "country": "germany",
    "countryName": "Germany",
    "documentType": "id_card",
    "documentId": "germany_residence_permit",
    "width": 35,
    "height": 45,
    "unit": "mm",
    "dpi": 600,
    "backgroundColor": "#eeeeee",
    "widthMm": 35,
    "heightMm": 45,
    "headMinMm": 32,
    "headMaxMm": 36,
    "expressionStrict": true,
    "expression": "neutral, mouth closed, eyes open"
  },
  {
    "id": 226,
    "countryCode": "DE",
    "country": "germany",
    "countryName": "Germany",
    "documentType": "other",
    "documentId": "germany_bus_pass",
    "width": 35,
    "height": 45,
    "unit": "mm",
    "dpi": 600,
    "backgroundColor": "#eeeeee",
    "widthMm": 35,
    "heightMm": 45,
    "headMinMm": 32,
    "headMaxMm": 36,
    "expressionStrict": true,
    "expression": "neutral, mouth closed, eyes open"
  },
  {
    "id": 227,
    "countryCode": "DE",
    "country": "germany",
    "countryName": "Germany",
    "documentType": "other",
    "documentId": "germany_health_card",
    "width": 35,
    "height": 45,
    "unit": "mm",
    "dpi": 600,
    "backgroundColor": "#eeeeee",
    "widthMm": 35,
    "heightMm": 45,
    "headMinMm": 32,
    "headMaxMm": 36,
    "expressionStrict": true,
    "expression": "neutral, mouth closed, eyes open"
  },
  {
    "id": 228,
    "countryCode": "DE",
    "country": "germany",
    "countryName": "Germany",
    "documentType": "other",
    "documentId": "germany_player_passport",
    "width": 375,
    "height": 500,
    "unit": "px",
    "dpi": 300,
    "backgroundColor": "#ffffff",
    "pixelWidth": 375,
    "pixelHeight": 500
  },
  {
    "id": 229,
    "countryCode": "DE",
    "country": "germany",
    "countryName": "Germany",
    "documentType": "other",
    "documentId": "germany_rail_card",
    "width": 35,
    "height": 45,
    "unit": "mm",
    "dpi": 600,
    "backgroundColor": "#eeeeee",
    "widthMm": 35,
    "heightMm": 45,
    "headMinMm": 32,
    "headMaxMm": 36,
    "expressionStrict": true,
    "expression": "neutral, mouth closed, eyes open"
  },
  {
    "id": 230,
    "countryCode": "DE",
    "country": "germany",
    "countryName": "Germany",
    "documentType": "passport",
    "documentId": "germany_passport",
    "width": 35,
    "height": 45,
    "unit": "mm",
    "dpi": 600,
    "backgroundColor": "#eeeeee",
    "widthMm": 35,
    "heightMm": 45,
    "headMinMm": 32,
    "headMaxMm": 36,
    "expressionStrict": true,
    "expression": "neutral, mouth closed, eyes open",
    "guide": "https://www.idphotowork.com/germany-passport-photo.html"
  },
  {
    "id": 231,
    "countryCode": "DE",
    "country": "germany",
    "countryName": "Germany",
    "documentType": "visa",
    "documentId": "germany_visa",
    "width": 35,
    "height": 45,
    "unit": "mm",
    "dpi": 600,
    "backgroundColor": "#eeeeee",
    "widthMm": 35,
    "heightMm": 45,
    "headMinMm": 32,
    "headMaxMm": 36,
    "expressionStrict": true,
    "expression": "neutral, mouth closed, eyes open"
  }
]
