[
  {
    "id": 373,
    "countryCode": "LU",
    "country": "luxembourg",
    "countryName": "Luxembourg",
    "documentType": "driving_licence",
    "documentId": "luxembourg_driving_license",
    "width": 35,
    "height": 45,
    "unit": "mm",
    "dpi": 600,
    "backgroundColor": "#eeeeee",
    "widthMm": 35,
    "heightMm": 45,
    "headMinMm": 32,
    "headMaxMm": 36,
    "expressionStrict": true,
    "expression": "neutral, mouth closed, eyes open"
  },
  {
    "id": 374,
    "countryCode": "LU",
    "country": "luxembourg",
    "countryName": "Luxembourg",
    "documentType": "id_card",
    "documentId": "luxembourg_residence",
    "width": 35,
    "height": 45,
    "unit": "mm",
    "dpi": 600,
    "backgroundColor": "#eeeeee",
    "widthMm": 35,
    "heightMm": 45,
    "headMinMm": 32,
    "headMaxMm": 36,
    "expressionStrict": true,
    "expression": "neutral, mouth closed, eyes open"
  },
  {
    "id": 375,
    "countryCode": "LU",
    "country": "luxembourg",
    "countryName": "Luxembourg",
    "documentType": "passport",
    "documentId": "luxembourg_passport",
    "width": 35,
    "height": 45,
    "unit": "mm",
    "dpi": 600,
    "backgroundColor": "#eeeeee",
    "widthMm": 35,
    "heightMm": 45,
    "headMinMm": 32,
    "headMaxMm": 36,
    "expressionStrict": true,
    "expression": "neutral, mouth closed, eyes open"
  },
  {
    "id": 376,
    "countryCode": "LU",
    "country": "luxembourg",
    "countryName": "Luxembourg",
    "documentType": "visa",
    "documentId": "luxembourg_visa",
    "width": 35,
    "height": 45,
    "unit": "mm",
    "dpi": 600,
    "backgroundColor": "#eeeeee",
    "widthMm": 35,
    "heightMm": 45,
    "headMinMm": 32,
    "headMaxMm": 36,
    "expressionStrict": true,
    "expression": "neutral, mouth closed, eyes open"
  }
]
