[
  {
    "id": 193,
    "countryCode": "FI",
    "country": "finland",
    "countryName": "Finland",
    "documentType": "driving_licence",
    "documentId": "finland_driving_licence",
    "width": 36,
    "height": 47,
    "unit": "mm",
    "dpi": 353,
    "backgroundColor": "#eeeeee",
    "widthMm": 36,
    "heightMm": 47
  },
  {
    "id": 194,
    "countryCode": "FI",
    "country": "finland",
    "countryName": "Finland",
    "documentType": "id_card",
    "documentId": "finland_id_card_offline",
    "width": 36,
    "height": 47,
    "unit": "mm",
    "dpi": 353,
    "backgroundColor": "#eeeeee",
    "widthMm": 36,
    "heightMm": 47
  },
  {
    "id": 195,
    "countryCode": "FI",
    "country": "finland",
    "countryName": "Finland",
    "documentType": "id_card",
    "documentId": "finland_id_card_online",
    "width": 500,
    "height": 653,
    "unit": "px",
    "dpi": 300,
    "backgroundColor": "#eeeeee",
    "pixelWidth": 500,
    "pixelHeight": 653
  },
  {
    "id": 196,
    "countryCode": "FI",
    "country": "finland",
    "countryName": "Finland",
    "documentType": "other",
    "documentId": "finland_firearms_permit",
    "width": 36,
    "height": 47,
    "unit": "mm",
    "dpi": 353,
    "backgroundColor": "#eeeeee",
    "widthMm": 36,
    "heightMm": 47
  },
  {
    "id": 197,
    "countryCode": "FI",
    "country": "finland",
    "countryName": "Finland",
    "documentType": "passport",
    "documentId": "finland_passport",
    "width": 36,
    "height": 47,
    "unit": "mm",
    "dpi": 353,
    "backgroundColor": "#eeeeee",
    "widthMm": 36,
    "heightMm": 47
  },
  {
    "id": 198,
    "countryCode": "FI",
    "country": "finland",
    "countryName": "Finland",
    "documentType": "passport",
    "documentId": "finland_passport_online",
    "width": 500,
    "height": 653,
    "unit": "px",
    "dpi": 300,
    "backgroundColor": "#eeeeee",
    "pixelWidth": 500,
    "pixelHeight": 653
  },
  {
    "id": 199,
    "countryCode": "FI",
    "country": "finland",
    "countryName": "Finland",
    "documentType": "visa",
    "documentId": "finland_residence",
    "width": 36,
    "height": 47,
    "unit": "mm",
    "dpi": 353,
    "backgroundColor": "#eeeeee",
    "widthMm": 36,
    "heightMm": 47
  },
  {
    "id": 200,
    "countryCode": "FI",
    "country": "finland",
    "countryName": "Finland",
    "documentType": "visa",
    "documentId": "finland_visa",
    "width": 36,
    "height": 47,
    "unit": "mm",
    "dpi": 353,
    "backgroundColor": "#eeeeee",
    "widthMm": 36,
    "heightMm": 47
  }
]
