[
  {
    "id": 394,
    "countryCode": "MT",
    "country": "malta",
    "countryName": "Malta",
    "documentType": "passport",
    "documentId": "malta_passport",
    "width": 35,
    "height": 45,
    "unit": "mm",
    "dpi": 600,
    "backgroundColor": "#ffffff",
    "widthMm": 35,
    "heightMm": 45,
    "headMinMm": 32,
    "headMaxMm": 36,
    "expressionStrict": true,
    "expression": "neutral, mouth closed, eyes open",
    "needsReview": true
  },
  {
    "id": 395,
    "countryCode": "MT",
    "country": "malta",
    "countryName": "Malta",
    "documentType": "visa",
    "documentId": "malta_visa",
    "width": 35,
    "height": 45,
    "unit": "mm",
    "dpi": 600,
    "backgroundColor": "#eeeeee",
    "widthMm": 35,
    "heightMm": 45,
    "headMinMm": 32,
    "headMaxMm": 36,
    "expressionStrict": true,
    "expression": "neutral, mouth closed, eyes open"
  }
]
