[
  {
    "id": 420,
    "countryCode": "MM",
    "country": "myanmar",
    "countryName": "Myanmar",
    "documentType": "driving_licence",
    "documentId": "myanmar_driving_license",
    "width": 35,
    "height": 45,
    "unit": "mm",
    "dpi": 600,
    "backgroundColor": "#96b9ef",
    "widthMm": 35,
    "heightMm": 45
  },
  {
    "id": 421,
    "countryCode": "MM",
    "country": "myanmar",
    "countryName": "Myanmar",
    "documentType": "id_card",
    "documentId": "myanmar_permanent_residence",
    "width": 2,
    "height": 2,
    "unit": "in",
    "dpi": 300,
    "backgroundColor": "#ffffff",
    "widthMm": 50.8,
    "heightMm": 50.8
  },
  {
    "id": 422,
    "countryCode": "MM",
    "country": "myanmar",
    "countryName": "Myanmar",
    "documentType": "passport",
    "documentId": "myanmar_passport",
    "width": 35,
    "height": 45,
    "unit": "mm",
    "dpi": 600,
    "backgroundColor": "#ffffff",
    "widthMm": 35,
    "heightMm": 45
  },
  {
    "id": 423,
    "countryCode": "MM",
    "country": "myanmar",
    "countryName": "Myanmar",
    "documentType": "visa",
    "documentId": "myanmar_burma_visa",
    "width": 38,
    "height": 46,
    "unit": "mm",
    "dpi": 300,
    "backgroundColor": "#eeeeee",
    "widthMm": 38,
    "heightMm": 46,
    "needsReview": true
  },
  {
    "id": 424,
    "countryCode": "MM",
    "country": "myanmar",
    "countryName": "Myanmar",
    "documentType": "visa",
    "documentId": "myanmar_visa",
    "width": 2,
    "height": 2,
    "unit": "in",
    "dpi": 300,
    "backgroundColor": "#ffffff",
    "widthMm": 50.8,
    "heightMm": 50.8
  }
]
