[
  {
    "id": 511,
    "countryCode": "QA",
    "country": "qatar",
    "countryName": "Qatar",
    "documentType": "driving_licence",
    "documentId": "qatar_driving_license",
    "width": 38,
    "height": 48,
    "unit": "mm",
    "dpi": 300,
    "backgroundColor": "#eeeeee",
    "widthMm": 38,
    "heightMm": 48
  },
  {
    "id": 512,
    "countryCode": "QA",
    "country": "qatar",
    "countryName": "Qatar",
    "documentType": "id_card",
    "documentId": "qatar_id_card",
    "width": 38,
    "height": 48,
    "unit": "mm",
    "dpi": 300,
    "backgroundColor": "#eeeeee",
    "widthMm": 38,
    "heightMm": 48
  },
  {
    "id": 513,
    "countryCode": "QA",
    "country": "qatar",
    "countryName": "Qatar",
    "documentType": "other",
    "documentId": "qatar_hayya_platform",
    "width": 30,
    "height": 40,
    "unit": "mm",
    "dpi": 720,
    "backgroundColor": "#ffffff",
    "widthMm": 30,
    "heightMm": 40
  },
  {
    "id": 514,
    "countryCode": "QA",
    "country": "qatar",
    "countryName": "Qatar",
    "documentType": "passport",
    "documentId": "qatar_passport",
    "width": 38,
    "height": 48,
    "unit": "mm",
    "dpi": 300,
    "backgroundColor": "#eeeeee",
    "widthMm": 38,
    "heightMm": 48
  },
  {
    "id": 515,
    "countryCode": "QA",
    "country": "qatar",
    "countryName": "Qatar",
    "documentType": "visa",
    "documentId": "qatar_visa",
    "width": 38,
    "height": 48,
    "unit": "mm",
    "dpi": 300,
    "backgroundColor": "#eeeeee",
    "widthMm": 38,
    "heightMm": 48
  }
]
