[
  {
    "id": 450,
    "countryCode": "NG",
    "country": "nigeria",
    "countryName": "Nigeria",
    "documentType": "other",
    "documentId": "nigeria_ecowas",
    "width": 40,
    "height": 40,
    "unit": "mm",
    "dpi": 300,
    "backgroundColor": "#ffffff",
    "widthMm": 40,
    "heightMm": 40
  },
  {
    "id": 451,
    "countryCode": "NG",
    "country": "nigeria",
    "countryName": "Nigeria",
    "documentType": "other",
    "documentId": "nnpc_recruitement",
    "width": 50,
    "height": 50,
    "unit": "mm",
    "dpi": 300,
    "backgroundColor": "#ffffff",
    "widthMm": 50,
    "heightMm": 50
  },
  {
    "id": 452,
    "countryCode": "NG",
    "country": "nigeria",
    "countryName": "Nigeria",
    "documentType": "passport",
    "documentId": "nigeria_passport",
    "width": 35,
    "height": 45,
    "unit": "mm",
    "dpi": 600,
    "backgroundColor": "#ffffff",
    "widthMm": 35,
    "heightMm": 45,
    "guide": "https://www.idphotowork.com/nigeria-passport-photo.html"
  },
  {
    "id": 453,
    "countryCode": "NG",
    "country": "nigeria",
    "countryName": "Nigeria",
    "documentType": "visa",
    "documentId": "niger_visa",
    "width": 2,
    "height": 2,
    "unit": "in",
    "dpi": 300,
    "backgroundColor": "#ffffff",
    "widthMm": 50.8,
    "heightMm": 50.8
  },
  {
    "id": 454,
    "countryCode": "NG",
    "country": "nigeria",
    "countryName": "Nigeria",
    "documentType": "visa",
    "documentId": "nigeria_online_visa",
    "width": 350,
    "height": 450,
    "unit": "px",
    "dpi": 300,
    "backgroundColor": "#ffffff",
    "pixelWidth": 350,
    "pixelHeight": 450
  },
  {
    "id": 455,
    "countryCode": "NG",
    "country": "nigeria",
    "countryName": "Nigeria",
    "documentType": "visa",
    "documentId": "nigeria_visa",
    "width": 35,
    "height": 45,
    "unit": "mm",
    "dpi": 600,
    "backgroundColor": "#ffffff",
    "widthMm": 35,
    "heightMm": 45
  }
]
