[
  {
    "id": 115,
    "countryCode": "CN",
    "country": "china",
    "countryName": "China",
    "documentType": "driving_licence",
    "documentId": "china_driving_license",
    "width": 22,
    "height": 32,
    "unit": "mm",
    "dpi": 300,
    "backgroundColor": "#ffffff",
    "widthMm": 22,
    "heightMm": 32
  },
  {
    "id": 116,
    "countryCode": "CN",
    "country": "china",
    "countryName": "China",
    "documentType": "id_card",
    "documentId": "china_green_card",
    "width": 33,
    "height": 48,
    "unit": "mm",
    "dpi": 600,
    "backgroundColor": "#eeeeee",
    "widthMm": 33,
    "heightMm": 48,
    "headMinMm": 28,
    "headMaxMm": 33
  },
  {
    "id": 117,
    "countryCode": "CN",
    "country": "china",
    "countryName": "China",
    "documentType": "id_card",
    "documentId": "china_medicare_card",
    "width": 26,
    "height": 32,
    "unit": "mm",
    "dpi": 350,
    "backgroundColor": "#ffffff",
    "widthMm": 26,
    "heightMm": 32
  },
  {
    "id": 118,
    "countryCode": "CN",
    "country": "china",
    "countryName": "China",
    "documentType": "id_card",
    "documentId": "china_resident_id_card",
    "width": 26,
    "height": 32,
    "unit": "mm",
    "dpi": 350,
    "backgroundColor": "#ffffff",
    "widthMm": 26,
    "heightMm": 32
  },
  {
    "id": 119,
    "countryCode": "CN",
    "country": "china",
    "countryName": "China",
    "documentType": "id_card",
    "documentId": "china_social_security_card",
    "width": 26,
    "height": 32,
    "unit": "mm",
    "dpi": 350,
    "backgroundColor": "#ffffff",
    "widthMm": 26,
    "heightMm": 32
  },
  {
    "id": 120,
    "countryCode": "CN",
    "country": "china",
    "countryName": "China",
    "documentType": "other",
    "documentId": "china_apec_business_travel_card",
    "width": 300,
    "height": 400,
    "unit": "px",
    "dpi": 300,
    "backgroundColor": "#ffffff",
    "pixelWidth": 300,
    "pixelHeight": 400
  },
  {
    "id": 121,
    "countryCode": "CN",
    "country": "china",
    "countryName": "China",
    "documentType": "other",
    "documentId": "licensed_pharmacist",
    "width": 215,
    "height": 300,
    "unit": "px",
    "dpi": 300,
    "backgroundColor": "#ffffff",
    "pixelWidth": 215,
    "pixelHeight": 300
  },
  {
    "id": 122,
    "countryCode": "CN",
    "country": "china",
    "countryName": "China",
    "documentType": "other",
    "documentId": "national_computer_rank_examination",
    "width": 144,
    "height": 192,
    "unit": "px",
    "dpi": 300,
    "backgroundColor": "#ffffff",
    "pixelWidth": 144,
    "pixelHeight": 192
  },
  {
    "id": 123,
    "countryCode": "CN",
    "country": "china",
    "countryName": "China",
    "documentType": "other",
    "documentId": "putonghua_proficiency_test",
    "width": 390,
    "height": 567,
    "unit": "px",
    "dpi": 300,
    "backgroundColor": "#309eff",
    "pixelWidth": 390,
    "pixelHeight": 567
  },
  {
    "id": 124,
    "countryCode": "CN",
    "country": "china",
    "countryName": "China",
    "documentType": "passport",
    "documentId": "china_passport",
    "width": 33,
    "height": 48,
    "unit": "mm",
    "dpi": 600,
    "backgroundColor": "#ffffff",
    "widthMm": 33,
    "heightMm": 48,
    "headMinMm": 28,
    "headMaxMm": 33,
    "guide": "https://www.idphotowork.com/china-passport-photo.html"
  },
  {
    "id": 125,
    "countryCode": "CN",
    "country": "china",
    "countryName": "China",
    "documentType": "passport",
    "documentId": "china_passport_online",
    "width": 354,
    "height": 472,
    "unit": "px",
    "dpi": 300,
    "backgroundColor": "#ffffff",
    "pixelWidth": 354,
    "pixelHeight": 472,
    "guide": "https://www.idphotowork.com/china-passport-photo.html"
  },
  {
    "id": 126,
    "countryCode": "CN",
    "country": "china",
    "countryName": "China",
    "documentType": "visa",
    "documentId": "china_visa",
    "width": 33,
    "height": 48,
    "unit": "mm",
    "dpi": 600,
    "backgroundColor": "#ffffff",
    "widthMm": 33,
    "heightMm": 48,
    "headMinMm": 28,
    "headMaxMm": 33
  },
  {
    "id": 127,
    "countryCode": "CN",
    "country": "china",
    "countryName": "China",
    "documentType": "visa",
    "documentId": "china_visa_online",
    "width": 354,
    "height": 472,
    "unit": "px",
    "dpi": 300,
    "backgroundColor": "#ffffff",
    "pixelWidth": 354,
    "pixelHeight": 472
  }
]
