[
  {
    "id": 27,
    "countryCode": "AT",
    "country": "austria",
    "countryName": "Austria",
    "documentType": "driving_licence",
    "documentId": "austria_bicycle_passport",
    "width": 35,
    "height": 45,
    "unit": "mm",
    "dpi": 600,
    "backgroundColor": "#eeeeee",
    "widthMm": 35,
    "heightMm": 45,
    "headMinMm": 32,
    "headMaxMm": 36,
    "expressionStrict": true,
    "expression": "neutral, mouth closed, eyes open"
  },
  {
    "id": 28,
    "countryCode": "AT",
    "country": "austria",
    "countryName": "Austria",
    "documentType": "driving_licence",
    "documentId": "austrian_driving_license",
    "width": 35,
    "height": 45,
    "unit": "mm",
    "dpi": 600,
    "backgroundColor": "#eeeeee",
    "widthMm": 35,
    "heightMm": 45,
    "headMinMm": 32,
    "headMaxMm": 36,
    "expressionStrict": true,
    "expression": "neutral, mouth closed, eyes open"
  },
  {
    "id": 29,
    "countryCode": "AT",
    "country": "austria",
    "countryName": "Austria",
    "documentType": "id_card",
    "documentId": "austria_civil_engineer_id_card",
    "width": 35,
    "height": 45,
    "unit": "mm",
    "dpi": 600,
    "backgroundColor": "#eeeeee",
    "widthMm": 35,
    "heightMm": 45,
    "headMinMm": 32,
    "headMaxMm": 36,
    "expressionStrict": true,
    "expression": "neutral, mouth closed, eyes open"
  },
  {
    "id": 30,
    "countryCode": "AT",
    "country": "austria",
    "countryName": "Austria",
    "documentType": "id_card",
    "documentId": "austrian_id_card",
    "width": 35,
    "height": 45,
    "unit": "mm",
    "dpi": 600,
    "backgroundColor": "#eeeeee",
    "widthMm": 35,
    "heightMm": 45,
    "headMinMm": 32,
    "headMaxMm": 36,
    "expressionStrict": true,
    "expression": "neutral, mouth closed, eyes open"
  },
  {
    "id": 31,
    "countryCode": "AT",
    "country": "austria",
    "countryName": "Austria",
    "documentType": "id_card",
    "documentId": "austrian_residence_permit",
    "width": 35,
    "height": 45,
    "unit": "mm",
    "dpi": 600,
    "backgroundColor": "#eeeeee",
    "widthMm": 35,
    "heightMm": 45,
    "headMinMm": 32,
    "headMaxMm": 36,
    "expressionStrict": true,
    "expression": "neutral, mouth closed, eyes open"
  },
  {
    "id": 32,
    "countryCode": "AT",
    "country": "austria",
    "countryName": "Austria",
    "documentType": "other",
    "documentId": "austria_e_card",
    "width": 35,
    "height": 45,
    "unit": "mm",
    "dpi": 600,
    "backgroundColor": "#eeeeee",
    "widthMm": 35,
    "heightMm": 45,
    "headMinMm": 32,
    "headMaxMm": 36,
    "expressionStrict": true,
    "expression": "neutral, mouth closed, eyes open"
  },
  {
    "id": 33,
    "countryCode": "AT",
    "country": "austria",
    "countryName": "Austria",
    "documentType": "other",
    "documentId": "austria_obb_card",
    "width": 35,
    "height": 45,
    "unit": "mm",
    "dpi": 600,
    "backgroundColor": "#eeeeee",
    "widthMm": 35,
    "heightMm": 45,
    "headMinMm": 32,
    "headMaxMm": 36,
    "expressionStrict": true,
    "expression": "neutral, mouth closed, eyes open"
  },
  {
    "id": 34,
    "countryCode": "AT",
    "country": "austria",
    "countryName": "Austria",
    "documentType": "other",
    "documentId": "austria_weapons_passport",
    "width": 35,
    "height": 45,
    "unit": "mm",
    "dpi": 600,
    "backgroundColor": "#eeeeee",
    "widthMm": 35,
    "heightMm": 45,
    "headMinMm": 32,
    "headMaxMm": 36,
    "expressionStrict": true,
    "expression": "neutral, mouth closed, eyes open"
  },
  {
    "id": 35,
    "countryCode": "AT",
    "country": "austria",
    "countryName": "Austria",
    "documentType": "passport",
    "documentId": "austria_passport",
    "width": 35,
    "height": 45,
    "unit": "mm",
    "dpi": 600,
    "backgroundColor": "#eeeeee",
    "widthMm": 35,
    "heightMm": 45,
    "headMinMm": 32,
    "headMaxMm": 36,
    "expressionStrict": true,
    "expression": "neutral, mouth closed, eyes open"
  },
  {
    "id": 36,
    "countryCode": "AT",
    "country": "austria",
    "countryName": "Austria",
    "documentType": "visa",
    "documentId": "austria_visa",
    "width": 35,
    "height": 45,
    "unit": "mm",
    "dpi": 600,
    "backgroundColor": "#eeeeee",
    "widthMm": 35,
    "heightMm": 45,
    "headMinMm": 32,
    "headMaxMm": 36,
    "expressionStrict": true,
    "expression": "neutral, mouth closed, eyes open"
  }
]
