[
  {
    "id": 53,
    "countryCode": "BY",
    "country": "belarus",
    "countryName": "Belarus",
    "documentType": "driving_licence",
    "documentId": "belarus_driving_license",
    "width": 40,
    "height": 50,
    "unit": "mm",
    "dpi": 600,
    "backgroundColor": "#eeeeee",
    "widthMm": 40,
    "heightMm": 50
  },
  {
    "id": 54,
    "countryCode": "BY",
    "country": "belarus",
    "countryName": "Belarus",
    "documentType": "id_card",
    "documentId": "belarus_citizenship",
    "width": 30,
    "height": 40,
    "unit": "mm",
    "dpi": 600,
    "backgroundColor": "#ffffff",
    "widthMm": 30,
    "heightMm": 40
  },
  {
    "id": 55,
    "countryCode": "BY",
    "country": "belarus",
    "countryName": "Belarus",
    "documentType": "passport",
    "documentId": "belarus_passport",
    "width": 40,
    "height": 50,
    "unit": "mm",
    "dpi": 600,
    "backgroundColor": "#eeeeee",
    "widthMm": 40,
    "heightMm": 50
  },
  {
    "id": 56,
    "countryCode": "BY",
    "country": "belarus",
    "countryName": "Belarus",
    "documentType": "visa",
    "documentId": "belarus_residence",
    "width": 40,
    "height": 50,
    "unit": "mm",
    "dpi": 600,
    "backgroundColor": "#eeeeee",
    "widthMm": 40,
    "heightMm": 50
  },
  {
    "id": 57,
    "countryCode": "BY",
    "country": "belarus",
    "countryName": "Belarus",
    "documentType": "visa",
    "documentId": "belarus_visa",
    "width": 35,
    "height": 45,
    "unit": "mm",
    "dpi": 600,
    "backgroundColor": "#eeeeee",
    "widthMm": 35,
    "heightMm": 45
  }
]
