[
  {
    "id": 568,
    "countryCode": "SI",
    "country": "slovenia",
    "countryName": "Slovenia",
    "documentType": "id_card",
    "documentId": "slovenia_id_card",
    "width": 35,
    "height": 45,
    "unit": "mm",
    "dpi": 600,
    "backgroundColor": "#a8aaab",
    "widthMm": 35,
    "heightMm": 45,
    "headMinMm": 32,
    "headMaxMm": 36,
    "expressionStrict": true,
    "expression": "neutral, mouth closed, eyes open"
  },
  {
    "id": 569,
    "countryCode": "SI",
    "country": "slovenia",
    "countryName": "Slovenia",
    "documentType": "id_card",
    "documentId": "slovenia_residence",
    "width": 35,
    "height": 45,
    "unit": "mm",
    "dpi": 600,
    "backgroundColor": "#a8aaab",
    "widthMm": 35,
    "heightMm": 45,
    "headMinMm": 32,
    "headMaxMm": 36,
    "expressionStrict": true,
    "expression": "neutral, mouth closed, eyes open"
  },
  {
    "id": 570,
    "countryCode": "SI",
    "country": "slovenia",
    "countryName": "Slovenia",
    "documentType": "other",
    "documentId": "slovenia_weapon_certificate",
    "width": 35,
    "height": 45,
    "unit": "mm",
    "dpi": 600,
    "backgroundColor": "#a8aaab",
    "widthMm": 35,
    "heightMm": 45,
    "headMinMm": 32,
    "headMaxMm": 36,
    "expressionStrict": true,
    "expression": "neutral, mouth closed, eyes open"
  },
  {
    "id": 571,
    "countryCode": "SI",
    "country": "slovenia",
    "countryName": "Slovenia",
    "documentType": "passport",
    "documentId": "slovenia_passport",
    "width": 35,
    "height": 45,
    "unit": "mm",
    "dpi": 600,
    "backgroundColor": "#a8aaab",
    "widthMm": 35,
    "heightMm": 45,
    "headMinMm": 32,
    "headMaxMm": 36,
    "expressionStrict": true,
    "expression": "neutral, mouth closed, eyes open"
  },
  {
    "id": 572,
    "countryCode": "SI",
    "country": "slovenia",
    "countryName": "Slovenia",
    "documentType": "visa",
    "documentId": "slovenia_visa",
    "width": 35,
    "height": 45,
    "unit": "mm",
    "dpi": 600,
    "backgroundColor": "#eeeeee",
    "widthMm": 35,
    "heightMm": 45,
    "headMinMm": 32,
    "headMaxMm": 36,
    "expressionStrict": true,
    "expression": "neutral, mouth closed, eyes open"
  }
]
